<?xml version="1.0" encoding="UTF-8"?>
<types xmlns="http://swmud.pl/ns/swaedit/types"
	xmlns:xsi="http://www.w3.org/2001/XMLSchema-instance"
	xsi:schemaLocation="http://swmud.pl/ns/swaedit/types src/types.xsd ">
	<type>
		<name>inside</name>
		<value>0</value>
	</type>
	<type>
		<name>city</name>
		<value>1</value>
	</type>
	<type>
		<name>field</name>
		<value>2</value>
	</type>
	<type>
		<name>forest</name>
		<value>3</value>
	</type>
	<type>
		<name>hills</name>
		<value>4</value>
	</type>
	<type>
		<name>mountain</name>
		<value>5</value>
	</type>
	<type>
		<name>water_swim</name>
		<value>6</value>
	</type>
	<type>
		<name>water_noswim</name>
		<value>7</value>
	</type>
	<type>
		<name>underwater</name>
		<value>8</value>
	</type>
	<type>
		<name>air</name>
		<value>9</value>
	</type>
	<type>
		<name>desert</name>
		<value>10</value>
	</type>
	<type>
		<name>dunno</name>
		<value>11</value>
	</type>
	<type>
		<name>oceanfloor</name>
		<value>12</value>
	</type>
	<type>
		<name>underground</name>
		<value>13</value>
	</type>
	<type>
		<name>jail_corridor</name>
		<value>14</value>
	</type>
	<type>
		<name>jail_office</name>
		<value>15</value>
	</type>
	<type>
		<name>jail_cell</name>
		<value>16</value>
	</type>
	<type>
		<name>jail_entrance</name>
		<value>17</value>
	</type>
</types>
