<?xml version="1.0" encoding="ISO-8859-2"?>
<types xmlns="http://swmud.pl/ns/swaedit/types"
	xmlns:xsi="http://www.w3.org/2001/XMLSchema-instance"
	xsi:schemaLocation="http://swmud.pl/ns/swaedit/types src/types.xsd ">
	<type>
		<name>dead</name>
		<value>0</value>
	</type>
	<type>
		<name>mortal</name>
		<value>1</value>
	</type>
	<type>
		<name>incap</name>
		<value>2</value>
	</type>
	<type>
		<name>stunned</name>
		<value>3</value>
	</type>
	<type>
		<name>sleeping</name>
		<value>4</value>
	</type>
	<type>
		<name>resting</name>
		<value>5</value>
	</type>
	<type>
		<name>sitting</name>
		<value>6</value>
	</type>
	<type>
		<name>fighting</name>
		<value>7</value>
	</type>
	<type>
		<name>standing</name>
		<value>8</value>
	</type>
	<type>
		<name>mounted</name>
		<value>9</value>
	</type>
	<type>
		<name>shove</name>
		<value>10</value>
	</type>
	<type>
		<name>drag</name>
		<value>11</value>
	</type>
</types>